PMID,Title,Authors,Citation,First Author,Journal/Book,Publication Year,Create Date,PMCID,NIHMS ID,DOI
"35660376","Risk factors for SARS-CoV-2 infection and transmission in households with children with asthma and allergy: A prospective surveillance study","Seibold MA, Moore CM, Everman JL, Williams BJM, Nolin JD, Fairbanks-Mahnke A, Plender EG, Patel BB, Arbes SJ, Bacharier LB, Bendixsen CG, Calatroni A, Camargo CA Jr, Dupont WD, Furuta GT, Gebretsadik T, Gruchalla RS, Gupta RS, Khurana Hershey GK, Murrison LB, Jackson DJ, Johnson CC, Kattan M, Liu AH, Lussier SJ, O'Connor GT, Rivera-Spoljaric K, Phipatanakul W, Rothenberg ME, Seroogy CM, Teach SJ, Zoratti EM, Togias A, Fulkerson PC, Hartert TV; HEROS study team.","J Allergy Clin Immunol. 2022 Jun 1:S0091-6749(22)00752-7. doi: 10.1016/j.jaci.2022.05.014. Online ahead of print.","Seibold MA","J Allergy Clin Immunol","2022","2022/06/06","PMC9155183","","10.1016/j.jaci.2022.05.014"
"35149044","Seasonal airway microbiome and transcriptome interactions promote childhood asthma exacerbations","McCauley KE, Flynn K, Calatroni A, DiMassa V, LaMere B, Fadrosh DW, Lynch KV, Gill MA, Pongracic JA, Khurana Hershey GK, Kercsmar CM, Liu AH, Johnson CC, Kim H, Kattan M, O'Connor GT, Bacharier LB, Teach SJ, Gergen PJ, Wheatley LM, Togias A, LeBeau P, Presnell S, Boushey HA, Busse WW, Gern JE, Jackson DJ, Altman MC, Lynch SV; National Institute of Allergy and Infectious Diseases–sponsored Inner-City Asthma Consortium.","J Allergy Clin Immunol. 2022 Feb 8:S0091-6749(22)00146-4. doi: 10.1016/j.jaci.2022.01.020. Online ahead of print.","McCauley KE","J Allergy Clin Immunol","2022","2022/02/12","","","10.1016/j.jaci.2022.01.020"
"34862819","17q12-q21 variants interact with early-life exposures to modify asthma risk in Black children","Gereige JD, Morin A, Calatroni A, Visness CM, Wood RA, Kattan M, Bacharier LB, Becker P, Altman MC, Gern JE, Ober C, O'Connor GT.","Clin Exp Allergy. 2022 Apr;52(4):565-568. doi: 10.1111/cea.14074. Epub 2021 Dec 12.","Gereige JD","Clin Exp Allergy","2022","2021/12/04","","","10.1111/cea.14074"
"34691392","Heterogeneity of magnitude, allergen immunodominance, and cytokine polarization of cockroach allergen-specific T cell responses in allergic sensitized children","da Silva Antunes R, Sutherland A, Frazier A, Schulten V, Pomés A, Glesner J, Calatroni A, Altman MC, Wood RA, O'Connor GT, Pongracic JA, Khurana Hershey GK, Kercsmar CM, Gruchalla RS, Gill M, Liu AH, Zoratti E, Kattan M, Busse PJ, Bacharier LB, Teach SJ, Wheatley LM, Togias A, Busse WW, Jackson DJ, Sette A.","Clin Transl Allergy. 2021 Oct 13;11(8):e12073. doi: 10.1002/clt2.12073. eCollection 2021 Oct.","da Silva Antunes R","Clin Transl Allergy","2021","2021/10/25","PMC8514843","","10.1002/clt2.12073"
"34212550","The Effect of Age on T-Regulatory Cell Number and Function in Patients With Asthma","Birmingham JM, Chesnova B, Wisnivesky JP, Calatroni A, Federman J, Bunyavanich S, Busse PJ.","Allergy Asthma Immunol Res. 2021 Jul;13(4):646-654. doi: 10.4168/aair.2021.13.4.646.","Birmingham JM","Allergy Asthma Immunol Res","2021","2021/07/02","PMC8255355","","10.4168/aair.2021.13.4.646"
"34166677","Trajectories of adiposity indicators and association with asthma and lung function in urban minority children","Lovinsky-Desir S, Lussier SJ, Calatroni A, Gergen PJ, Rivera-Spoljaric K, Bacharier LB, De A, O'Connor GT, Sandel MT, Wood RA, Arteaga-Solis E, Gern JE, Kattan M.","J Allergy Clin Immunol. 2021 Nov;148(5):1219-1226.e7. doi: 10.1016/j.jaci.2021.06.015. Epub 2021 Jun 22.","Lovinsky-Desir S","J Allergy Clin Immunol","2021","2021/06/24","PMC8578316","NIHMS1724371","10.1016/j.jaci.2021.06.015"
"33713771","Endotype of allergic asthma with airway obstruction in urban children","Altman MC, Calatroni A, Ramratnam S, Jackson DJ, Presnell S, Rosasco MG, Gergen PJ, Bacharier LB, O'Connor GT, Sandel MT, Kattan M, Wood RA, Visness CM, Gern JE; Inner City Asthma Consortium.","J Allergy Clin Immunol. 2021 Nov;148(5):1198-1209. doi: 10.1016/j.jaci.2021.02.040. Epub 2021 Mar 10.","Altman MC","J Allergy Clin Immunol","2021","2021/03/13","PMC8429519","NIHMS1695213","10.1016/j.jaci.2021.02.040"
"33713764","Maternal stress and depression are associated with respiratory phenotypes in urban children","Ramratnam SK, Lockhart A, Visness CM, Calatroni A, Jackson DJ, Gergen PJ, Bacharier LB, O'Connor GT, Sandel MT, Kattan M, Wood RA, Gern JE; Inner-City Asthma Consortium.","J Allergy Clin Immunol. 2021 Jul;148(1):120-127. doi: 10.1016/j.jaci.2021.03.005. Epub 2021 Mar 10.","Ramratnam SK","J Allergy Clin Immunol","2021","2021/03/13","PMC8273133","NIHMS1703499","10.1016/j.jaci.2021.03.005"
"33619370","Development of a human skin commensal microbe for bacteriotherapy of atopic dermatitis and use in a phase 1 randomized clinical trial","Nakatsuji T, Hata TR, Tong Y, Cheng JY, Shafiq F, Butcher AM, Salem SS, Brinton SL, Rudman Spergel AK, Johnson K, Jepson B, Calatroni A, David G, Ramirez-Gama M, Taylor P, Leung DYM, Gallo RL.","Nat Med. 2021 Apr;27(4):700-709. doi: 10.1038/s41591-021-01256-2. Epub 2021 Feb 22.","Nakatsuji T","Nat Med","2021","2021/02/23","PMC8052297","NIHMS1679973","10.1038/s41591-021-01256-2"
"32376491","Aeroallergen Sensitization, Serum IgE, and Eosinophilia as Predictors of Response to Omalizumab Therapy During the Fall Season Among Children with Persistent Asthma","Sheehan WJ, Krouse RZ, Calatroni A, Gergen PJ, Gern JE, Gill MA, Gruchalla RS, Khurana Hershey GK, Kattan M, Kercsmar CM, Lamm CI, Little FF, Makhija MM, Searing DA, Zoratti E, Busse WW, Teach SJ; NIAID-sponsored Inner-City Asthma Consortium.","J Allergy Clin Immunol Pract. 2020 Oct;8(9):3021-3028.e2. doi: 10.1016/j.jaip.2020.03.051. Epub 2020 May 4.","Sheehan WJ","J Allergy Clin Immunol Pract","2020","2020/05/08","PMC8775809","NIHMS1610251","10.1016/j.jaip.2020.03.051"
"32376483","Hyperlinear palms as a clinical finding in peanut allergy","Brar KK, Calatroni A, Berdyshev E, Palombi S, Goleva E, Leung DYM.","J Allergy Clin Immunol Pract. 2020 Sep;8(8):2823-2825. doi: 10.1016/j.jaip.2020.04.056. Epub 2020 May 4.","Brar KK","J Allergy Clin Immunol Pract","2020","2020/05/08","PMC7483281","NIHMS1590949","10.1016/j.jaip.2020.04.056"
"32360271","Skin tape proteomics identifies pathways associated with transepidermal water loss and allergen polysensitization in atopic dermatitis","Goleva E, Calatroni A, LeBeau P, Berdyshev E, Taylor P, Kreimer S, Cole RN, Leung DYM.","J Allergy Clin Immunol. 2020 Dec;146(6):1367-1378. doi: 10.1016/j.jaci.2020.04.022. Epub 2020 Apr 28.","Goleva E","J Allergy Clin Immunol","2020","2020/05/04","PMC7606732","NIHMS1605110","10.1016/j.jaci.2020.04.022"
"32347777","Lower influenza-specific cell-mediated immune responses in individuals with atopic dermatitis compared with healthy controls","Jalbert E, Lussier S, Johnson MJ, Jepson B, Calatroni A, David G, Leung D, Weinberg A.","Hum Vaccin Immunother. 2020 Nov 1;16(11):2727-2735. doi: 10.1080/21645515.2020.1747374. Epub 2020 Apr 29.","Jalbert E","Hum Vaccin Immunother","2020","2020/04/30","PMC7734037","","10.1080/21645515.2020.1747374"
"32004524","Serum IL-6: A biomarker in childhood asthma?","Jackson DJ, Bacharier LB, Calatroni A, Gill MA, Hu J, Liu AH, Wheatley LM, Gern JE, Gruchalla RS, Khurana Hershey GK, Kattan M, Kercsmar CM, Kim H, O'Connor GT, Patel S, Pongracic JA, Wood RA, Busse WW.","J Allergy Clin Immunol. 2020 Jun;145(6):1701-1704.e3. doi: 10.1016/j.jaci.2020.01.021. Epub 2020 Jan 28.","Jackson DJ","J Allergy Clin Immunol","2020","2020/02/01","PMC7282967","NIHMS1569791","10.1016/j.jaci.2020.01.021"
"31377342","Early decrease in basophil sensitivity to Ara h 2 precedes sustained unresponsiveness after peanut oral immunotherapy","Patil SU, Steinbrecher J, Calatroni A, Smith N, Ma A, Ruiter B, Virkud Y, Schneider M, Shreffler WG.","J Allergy Clin Immunol. 2019 Nov;144(5):1310-1319.e4. doi: 10.1016/j.jaci.2019.07.028. Epub 2019 Aug 1.","Patil SU","J Allergy Clin Immunol","2019","2019/08/05","PMC6905043","NIHMS1536420","10.1016/j.jaci.2019.07.028"
"31201891","Cockroach allergen component analysis of children with or without asthma and rhinitis in an inner-city birth cohort","Pomés A, Glesner J, Calatroni A, Visness CM, Wood RA, O'Connor GT, Kattan M, Bacharier LB, Wheatley LM, Gern JE, Busse WW; National Institute of Allergy and Infectious Diseases–funded Inner-City Asthma Consortium.","J Allergy Clin Immunol. 2019 Oct;144(4):935-944. doi: 10.1016/j.jaci.2019.05.036. Epub 2019 Jun 13.","Pomés A","J Allergy Clin Immunol","2019","2019/06/16","PMC7307589","NIHMS1587872","10.1016/j.jaci.2019.05.036"
"31201890","Distinct nasal airway bacterial microbiotas differentially relate to exacerbation in pediatric patients with asthma","McCauley K, Durack J, Valladares R, Fadrosh DW, Lin DL, Calatroni A, LeBeau PK, Tran HT, Fujimura KE, LaMere B, Merana G, Lynch K, Cohen RT, Pongracic J, Khurana Hershey GK, Kercsmar CM, Gill M, Liu AH, Kim H, Kattan M, Teach SJ, Togias A, Boushey HA, Gern JE, Jackson DJ, Lynch SV; National Institute of Allergy and Infectious Diseases–sponsored Inner-City Asthma Consortium.","J Allergy Clin Immunol. 2019 Nov;144(5):1187-1197. doi: 10.1016/j.jaci.2019.05.035. Epub 2019 Jun 13.","McCauley K","J Allergy Clin Immunol","2019","2019/06/16","PMC6842413","NIHMS1052077","10.1016/j.jaci.2019.05.035"
"31046157","The association of allergic sensitization patterns in early childhood with disease manifestations and immunological reactivity at 10 years of age","Schulten V, Frazier A, Calatroni A, Kattan M, Bacharier LB, O'Connor GT, Sandel MT, Wood RA, Wheatley LM, Togias A, Visness CM, Dresen A, Gern JE, Sette A.","Clin Exp Allergy. 2019 Aug;49(8):1087-1094. doi: 10.1111/cea.13406. Epub 2019 May 29.","Schulten V","Clin Exp Allergy","2019","2019/05/03","PMC6896992","NIHMS1059995","10.1111/cea.13406"
"30787169","The nonlesional skin surface distinguishes atopic dermatitis with food allergy as a unique endotype","Leung DYM, Calatroni A, Zaramela LS, LeBeau PK, Dyjack N, Brar K, David G, Johnson K, Leung S, Ramirez-Gama M, Liang B, Rios C, Montgomery MT, Richers BN, Hall CF, Norquest KA, Jung J, Bronova I, Kreimer S, Talbot CC Jr, Crumrine D, Cole RN, Elias P, Zengler K, Seibold MA, Berdyshev E, Goleva E.","Sci Transl Med. 2019 Feb 20;11(480):eaav2685. doi: 10.1126/scitranslmed.aav2685.","Leung DYM","Sci Transl Med","2019","2019/02/22","PMC7676854","NIHMS1644474","10.1126/scitranslmed.aav2685"
"30529451","A computerized decision support tool to implement asthma guidelines for children and adolescents","Kercsmar CM, Sorkness CA, Calatroni A, Gergen PJ, Bloomberg GR, Gruchalla RS, Kattan M, Liu AH, O'Connor GT, Pongracic JA, Szefler SJ, Teach SJ, Wildfire JJ, Wood RA, Zoratti EM, Busse WW; National Institute of Allergy and Infectious Diseases–sponsored Inner-City Asthma Consortium.","J Allergy Clin Immunol. 2019 May;143(5):1760-1768. doi: 10.1016/j.jaci.2018.10.060. Epub 2018 Dec 5.","Kercsmar CM","J Allergy Clin Immunol","2019","2018/12/12","PMC6504600","NIHMS1515891","10.1016/j.jaci.2018.10.060"
"30079758","Longitudinal Phenotypes of Respiratory Health in a High-Risk Urban Birth Cohort","Bacharier LB, Beigelman A, Calatroni A, Jackson DJ, Gergen PJ, O'Connor GT, Kattan M, Wood RA, Sandel MT, Lynch SV, Fujimura KE, Fadrosh DW, Santee CA, Boushey H, Visness CM, Gern JE; NIAID sponsored Inner-City Asthma Consortium.","Am J Respir Crit Care Med. 2019 Jan 1;199(1):71-82. doi: 10.1164/rccm.201801-0190OC.","Bacharier LB","Am J Respir Crit Care Med","2019","2018/08/07","PMC6353010","","10.1164/rccm.201801-0190OC"
"30055181","Building Bridges for Asthma Care: Reducing school absence for inner-city children with health disparities","Szefler SJ, Cloutier MM, Villarreal M, Hollenbach JP, Gleason M, Haas-Howard C, Vinick C, Calatroni A, Cicutto L, White M, Williams S, McGinn M, Langton C, Shocks D, Mitchell H, Stempel DA.","J Allergy Clin Immunol. 2019 Feb;143(2):746-754.e2. doi: 10.1016/j.jaci.2018.05.041. Epub 2018 Jul 25.","Szefler SJ","J Allergy Clin Immunol","2019","2018/07/29","","","10.1016/j.jaci.2018.05.041"
"29198587","Bedroom allergen exposures in US households","Salo PM, Wilkerson J, Rose KM, Cohn RD, Calatroni A, Mitchell HE, Sever ML, Gergen PJ, Thorne PS, Zeldin DC.","J Allergy Clin Immunol. 2018 May;141(5):1870-1879.e14. doi: 10.1016/j.jaci.2017.08.033. Epub 2017 Nov 30.","Salo PM","J Allergy Clin Immunol","2018","2017/12/05","PMC5938098","NIHMS914912","10.1016/j.jaci.2017.08.033"
"28939248","Early-life home environment and risk of asthma among inner-city children","O'Connor GT, Lynch SV, Bloomberg GR, Kattan M, Wood RA, Gergen PJ, Jaffee KF, Calatroni A, Bacharier LB, Beigelman A, Sandel MT, Johnson CC, Faruqi A, Santee C, Fujimura KE, Fadrosh D, Boushey H, Visness CM, Gern JE.","J Allergy Clin Immunol. 2018 Apr;141(4):1468-1475. doi: 10.1016/j.jaci.2017.06.040. Epub 2017 Sep 19.","O'Connor GT","J Allergy Clin Immunol","2018","2017/09/24","PMC6521865","NIHMS905861","10.1016/j.jaci.2017.06.040"
"28870461","Enhanced plasmacytoid dendritic cell antiviral responses after omalizumab","Gill MA, Liu AH, Calatroni A, Krouse RZ, Shao B, Schiltz A, Gern JE, Togias A, Busse WW.","J Allergy Clin Immunol. 2018 May;141(5):1735-1743.e9. doi: 10.1016/j.jaci.2017.07.035. Epub 2017 Sep 1.","Gill MA","J Allergy Clin Immunol","2018","2017/09/06","PMC6013066","NIHMS936934","10.1016/j.jaci.2017.07.035"
"28694047","Sensitization and Exposure to Pets: The Effect on Asthma Morbidity in the US Population","Gergen PJ, Mitchell HE, Calatroni A, Sever ML, Cohn RD, Salo PM, Thorne PS, Zeldin DC.","J Allergy Clin Immunol Pract. 2018 Jan-Feb;6(1):101-107.e2. doi: 10.1016/j.jaip.2017.05.019. Epub 2017 Jul 8.","Gergen PJ","J Allergy Clin Immunol Pract","2018","2017/07/12","PMC5756688","NIHMS891448","10.1016/j.jaip.2017.05.019"
"28647586","Graphic depiction of bioinformatics data","Calatroni A, Wildfire JJ.","J Allergy Clin Immunol. 2017 Dec;140(6):1519-1522. doi: 10.1016/j.jaci.2017.05.043. Epub 2017 Jun 21.","Calatroni A","J Allergy Clin Immunol","2017","2017/06/26","","","10.1016/j.jaci.2017.05.043"
"28618453","Data-driven programmatic approach to analysis of basophil activation tests","Patil SU, Calatroni A, Schneider M, Steinbrecher J, Smith N, Washburn C, Ma A, Shreffler WG.","Cytometry B Clin Cytom. 2018 Jul;94(4):667-673. doi: 10.1002/cyto.b.21537. Epub 2017 Jul 5.","Patil SU","Cytometry B Clin Cytom","2018","2017/06/16","PMC5732088","NIHMS917494","10.1002/cyto.b.21537"
"28608756","Effects of Omalizumab on Rhinovirus Infections, Illnesses, and Exacerbations of Asthma","Esquivel A, Busse WW, Calatroni A, Togias AG, Grindle KG, Bochkov YA, Gruchalla RS, Kattan M, Kercsmar CM, Khurana Hershey G, Kim H, Lebeau P, Liu AH, Szefler SJ, Teach SJ, West JB, Wildfire J, Pongracic JA, Gern JE.","Am J Respir Crit Care Med. 2017 Oct 15;196(8):985-992. doi: 10.1164/rccm.201701-0120OC.","Esquivel A","Am J Respir Crit Care Med","2017","2017/06/14","PMC5649984","","10.1164/rccm.201701-0120OC"
"28238748","Can we predict fall asthma exacerbations? Validation of the seasonal asthma exacerbation index","Hoch HE, Calatroni A, West JB, Liu AH, Gergen PJ, Gruchalla RS, Khurana Hershey GK, Kercsmar CM, Kim H, Lamm CI, Makhija MM, Mitchell HE, Teach SJ, Wildfire JJ, Busse WW, Szefler SJ.","J Allergy Clin Immunol. 2017 Oct;140(4):1130-1137.e5. doi: 10.1016/j.jaci.2017.01.026. Epub 2017 Feb 24.","Hoch HE","J Allergy Clin Immunol","2017","2017/02/28","PMC5568982","NIHMS864863","10.1016/j.jaci.2017.01.026"
"28089873","Patterns of immune development in urban preschoolers with recurrent wheeze and/or atopy","Gern JE, Calatroni A, Jaffee KF, Lynn H, Dresen A, Cruikshank WW, Lederman HM, Sampson HA, Shreffler W, Bacharier LB, Gergen PJ, Gold DR, Kattan M, O'Connor GT, Sandel MT, Wood RA, Bloomberg GR.","J Allergy Clin Immunol. 2017 Sep;140(3):836-844.e7. doi: 10.1016/j.jaci.2016.10.052. Epub 2017 Jan 13.","Gern JE","J Allergy Clin Immunol","2017","2017/01/17","PMC5509531","NIHMS843567","10.1016/j.jaci.2016.10.052"
"27744028","Minimally important differences and risk levels for the Composite Asthma Severity Index","Krouse RZ, Sorkness CA, Wildfire JJ, Calatroni A, Gruchalla R, Hershey GKK, Kattan M, Liu AH, Makhija M, Teach SJ, West JB, Wood RA, Zoratti EM, Gergen PJ.","J Allergy Clin Immunol. 2017 Mar;139(3):1052-1055. doi: 10.1016/j.jaci.2016.08.041. Epub 2016 Oct 12.","Krouse RZ","J Allergy Clin Immunol","2017","2016/10/17","PMC5342920","NIHMS822643","10.1016/j.jaci.2016.08.041"
"27725186","Effect of aging on sputum inflammation and asthma control","Busse PJ, Birmingham JM, Calatroni A, Manzi J, Goryachokovsky A, Fontela G, Federman AD, Wisnivesky JP.","J Allergy Clin Immunol. 2017 Jun;139(6):1808-1818.e6. doi: 10.1016/j.jaci.2016.09.015. Epub 2016 Oct 8.","Busse PJ","J Allergy Clin Immunol","2017","2016/10/12","PMC5385166","NIHMS821886","10.1016/j.jaci.2016.09.015"
"27027970","DNA Methylation Changes in Nasal Epithelia Are Associated with Allergic Asthma in the Inner City","Yang IV, Pedersen BS, Liu AH, O'Connor GT, Teach SJ, Kattan M, Misiak RT, Gruchalla R, Steinbach SF, Szefler SJ, Gill MA, Calatroni A, David G, Hennessy CE, Davidson EJ, Gergen P, Togias A, Busse WW, Schwartz DA.","Ann Am Thorac Soc. 2016 Mar;13 Suppl 1(Suppl 1):S99-S100. doi: 10.1513/AnnalsATS.201510-657MG.","Yang IV","Ann Am Thorac Soc","2016","2016/03/31","PMC5015744","","10.1513/AnnalsATS.201510-657MG"
"27025297","Individualized Household Allergen Intervention Lowers Allergen Level But Not Asthma Medication Use: A Randomized Controlled Trial","DiMango E, Serebrisky D, Narula S, Shim C, Keating C, Sheares B, Perzanowski M, Miller R, DiMango A, Andrews H, Merle D, Liu X, Calatroni A, Kattan M.","J Allergy Clin Immunol Pract. 2016 Jul-Aug;4(4):671-679.e4. doi: 10.1016/j.jaip.2016.01.016. Epub 2016 Mar 26.","DiMango E","J Allergy Clin Immunol Pract","2016","2016/03/31","PMC5295498","NIHMS845459","10.1016/j.jaip.2016.01.016"
"26518090","Preseasonal treatment with either omalizumab or an inhaled corticosteroid boost to prevent fall asthma exacerbations","Teach SJ, Gill MA, Togias A, Sorkness CA, Arbes SJ Jr, Calatroni A, Wildfire JJ, Gergen PJ, Cohen RT, Pongracic JA, Kercsmar CM, Khurana Hershey GK, Gruchalla RS, Liu AH, Zoratti EM, Kattan M, Grindle KA, Gern JE, Busse WW, Szefler SJ.","J Allergy Clin Immunol. 2015 Dec;136(6):1476-1485. doi: 10.1016/j.jaci.2015.09.008. Epub 2015 Oct 27.","Teach SJ","J Allergy Clin Immunol","2015","2015/11/01","PMC4679705","NIHMS727270","10.1016/j.jaci.2015.09.008"
"25985925","Peanut oral immunotherapy transiently expands circulating Ara h 2-specific B cells with a homologous repertoire in unrelated subjects","Patil SU, Ogunniyi AO, Calatroni A, Tadigotla VR, Ruiter B, Ma A, Moon J, Love JC, Shreffler WG.","J Allergy Clin Immunol. 2015 Jul;136(1):125-134.e12. doi: 10.1016/j.jaci.2015.03.026. Epub 2015 May 16.","Patil SU","J Allergy Clin Immunol","2015","2015/05/20","PMC4494892","NIHMS691988","10.1016/j.jaci.2015.03.026"
"25794658","Seasonal risk factors for asthma exacerbations among inner-city children","Teach SJ, Gergen PJ, Szefler SJ, Mitchell HE, Calatroni A, Wildfire J, Bloomberg GR, Kercsmar CM, Liu AH, Makhija MM, Matsui E, Morgan W, O'Connor G, Busse WW.","J Allergy Clin Immunol. 2015 Jun;135(6):1465-73.e5. doi: 10.1016/j.jaci.2014.12.1942. Epub 2015 Mar 18.","Teach SJ","J Allergy Clin Immunol","2015","2015/03/22","PMC4461505","NIHMS673378","10.1016/j.jaci.2014.12.1942"
"25769910","DNA methylation and childhood asthma in the inner city","Yang IV, Pedersen BS, Liu A, O'Connor GT, Teach SJ, Kattan M, Misiak RT, Gruchalla R, Steinbach SF, Szefler SJ, Gill MA, Calatroni A, David G, Hennessy CE, Davidson EJ, Zhang W, Gergen P, Togias A, Busse WW, Schwartz DA.","J Allergy Clin Immunol. 2015 Jul;136(1):69-80. doi: 10.1016/j.jaci.2015.01.025. Epub 2015 Mar 11.","Yang IV","J Allergy Clin Immunol","2015","2015/03/15","PMC4494877","NIHMS661111","10.1016/j.jaci.2015.01.025"
"24954275","Winter birth in inner-city asthmatic children is associated with increased food allergen sensitization risk","Bird JA, Wang J, Visness CM, Calatroni A, Sampson HA, Gruchalla R.","J Allergy Clin Immunol. 2014 Aug;134(2):490-2. doi: 10.1016/j.jaci.2014.05.002. Epub 2014 Jun 19.","Bird JA","J Allergy Clin Immunol","2014","2014/06/24","PMC4119828","NIHMS598032","10.1016/j.jaci.2014.05.002"
"24908147","Effects of early-life exposure to allergens and bacteria on recurrent wheeze and atopy in urban children","Lynch SV, Wood RA, Boushey H, Bacharier LB, Bloomberg GR, Kattan M, O'Connor GT, Sandel MT, Calatroni A, Matsui E, Johnson CC, Lynn H, Visness CM, Jaffee KF, Gergen PJ, Gold DR, Wright RJ, Fujimura K, Rauch M, Busse WW, Gern JE.","J Allergy Clin Immunol. 2014 Sep;134(3):593-601.e12. doi: 10.1016/j.jaci.2014.04.018. Epub 2014 Jun 4.","Lynch SV","J Allergy Clin Immunol","2014","2014/06/09","PMC4151305","NIHMS610577","10.1016/j.jaci.2014.04.018"
"24565455","Reassessment of omalizumab-dosing strategies and pharmacodynamics in inner-city children and adolescents","Sorkness CA, Wildfire JJ, Calatroni A, Mitchell HE, Busse WW, O'Connor GT, Pongracic JA, Ross K, Gill MA, Kattan M, Morgan WJ, Teach SJ, Gergen PJ, Liu AH, Szefler SJ.","J Allergy Clin Immunol Pract. 2013 Mar;1(2):163-71. doi: 10.1016/j.jaip.2013.01.011. Epub 2013 Feb 26.","Sorkness CA","J Allergy Clin Immunol Pract","2013","2014/02/26","PMC4254887","NIHMS548568","10.1016/j.jaip.2013.01.011"
"24522093","Prevalence of allergic sensitization in the United States: results from the National Health and Nutrition Examination Survey (NHANES) 2005-2006","Salo PM, Arbes SJ Jr, Jaramillo R, Calatroni A, Weir CH, Sever ML, Hoppin JA, Rose KM, Liu AH, Gergen PJ, Mitchell HE, Zeldin DC.","J Allergy Clin Immunol. 2014 Aug;134(2):350-9. doi: 10.1016/j.jaci.2013.12.1071. Epub 2014 Feb 9.","Salo PM","J Allergy Clin Immunol","2014","2014/02/14","PMC4119838","NIHMS553110","10.1016/j.jaci.2013.12.1071"
"23768574","Prophylactic use of sublingual allergen immunotherapy in high-risk children: a pilot study","Holt PG, Sly PD, Sampson HA, Robinson P, Loh R, Lowenstein H, Calatroni A, Sayre P.","J Allergy Clin Immunol. 2013 Oct;132(4):991-3.e1. doi: 10.1016/j.jaci.2013.04.049. Epub 2013 Jun 12.","Holt PG","J Allergy Clin Immunol","2013","2013/06/18","","","10.1016/j.jaci.2013.04.049"
"23595876","Lack of a relation between serum 25-hydroxyvitamin D concentrations and asthma in adolescents","Gergen PJ, Teach SJ, Mitchell HE, Freishtat RF, Calatroni A, Matsui E, Kattan M, Bloomberg GR, Liu AH, Kercsmar C, O'Connor G, Pongracic J, Rivera-Sanchez Y, Morgan WJ, Sorkness CA, Binkley N, Busse W.","Am J Clin Nutr. 2013 Jun;97(6):1228-34. doi: 10.3945/ajcn.112.046961. Epub 2013 Apr 17.","Gergen PJ","Am J Clin Nutr","2013","2013/04/19","PMC3652921","","10.3945/ajcn.112.046961"
"23085532","A multi-center ring trial of allergen analysis using fluorescent multiplex array technology","King EM, Filep S, Smith B, Platts-Mills T, Hamilton RG, Schmechel D, Sordillo JE, Milton D, van Ree R, Krop EJ, Heederik DJ, Metwali N, Thorne PS, Zeldin DC, Sever ML, Calatroni A, Arbes SJ Jr, Mitchell HE, Chapman MD.","J Immunol Methods. 2013 Jan 31;387(1-2):89-95. doi: 10.1016/j.jim.2012.09.015. Epub 2012 Oct 22.","King EM","J Immunol Methods","2013","2012/10/23","PMC3955085","NIHMS555355","10.1016/j.jim.2012.09.015"
"22975469","Development of a standardized approach for environmental microbiota investigations related to asthma development in children","Fujimura KE, Rauch M, Matsui E, Iwai S, Calatroni A, Lynn H, Mitchell H, Johnson CC, Gern JE, Togias A, Boushey HA, Kennedy S, Lynch SV.","J Microbiol Methods. 2012 Nov;91(2):231-9. doi: 10.1016/j.mimet.2012.08.016. Epub 2012 Sep 4.","Fujimura KE","J Microbiol Methods","2012","2012/09/15","PMC3615718","NIHMS411512","10.1016/j.mimet.2012.08.016"
"22244599","Development and validation of the Composite Asthma Severity Index--an outcome measure for use in children and adolescents","Wildfire JJ, Gergen PJ, Sorkness CA, Mitchell HE, Calatroni A, Kattan M, Szefler SJ, Teach SJ, Bloomberg GR, Wood RA, Liu AH, Pongracic JA, Chmiel JF, Conroy K, Rivera-Sanchez Y, Busse WW, Morgan WJ.","J Allergy Clin Immunol. 2012 Mar;129(3):694-701. doi: 10.1016/j.jaci.2011.12.962. Epub 2012 Jan 12.","Wildfire JJ","J Allergy Clin Immunol","2012","2012/01/17","PMC3294274","NIHMS350008","10.1016/j.jaci.2011.12.962"
"21941139","Impact of hydroxyurea on perioperative management and outcomes in children with sickle cell anemia","Hayashi M, Calatroni A, Herzberg B, Ross AK, Rice HE, Thornburg C.","J Pediatr Hematol Oncol. 2011 Oct;33(7):487-90. doi: 10.1097/MPH.0b013e318230b2f4.","Hayashi M","J Pediatr Hematol Oncol","2011","2011/09/24","","","10.1097/MPH.0b013e318230b2f4"
"21872304","Correlation of specific IgE to shrimp with cockroach and dust mite exposure and sensitization in an inner-city population","Wang J, Calatroni A, Visness CM, Sampson HA.","J Allergy Clin Immunol. 2011 Oct;128(4):834-7. doi: 10.1016/j.jaci.2011.07.045. Epub 2011 Aug 26.","Wang J","J Allergy Clin Immunol","2011","2011/08/30","PMC3185202","NIHMS315314","10.1016/j.jaci.2011.07.045"
"21516020","Differences in health-related quality of life in children with sickle cell disease receiving hydroxyurea","Thornburg CD, Calatroni A, Panepinto JA.","J Pediatr Hematol Oncol. 2011 May;33(4):251-4. doi: 10.1097/MPH.0b013e3182114c54.","Thornburg CD","J Pediatr Hematol Oncol","2011","2011/04/26","PMC3729442","NIHMS491068","10.1097/MPH.0b013e3182114c54"
